Pergunta,Opção 1,Opção 2,Opção 3,Opção 4,Resposta Correta
"Qual é a capital do Brasil?","Brasília","Rio de Janeiro","São Paulo","Belo Horizonte",1
"Qual é o maior planeta do sistema solar?","Terra","Júpiter","Vênus","Marte",2
"Qual é o maior mamífero terrestre?","Elefante","Girafa","Rinoceronte","Hipopótamo",1
"Qual é o maior oceano do mundo?","Oceano Atlântico","Oceano Índico","Oceano Pacífico","Oceano Ártico",3
"Qual é o maior continente do mundo?","América do Norte","África","Ásia","Europa",3